{
  "$schema": "../anatomy.schema.json",
  "name": "breadcrumb",
  "behavior": "APG breadcrumb pattern (nav landmark with an accessible name; an ordered list of links; the last/current entry carries aria-current=page and is not a link; separators are decorative and hidden from assistive tech)",
  "parts": [
    { "part": "root", "tokens": [], "note": "the nav landmark; aria-label names the trail" },
    { "part": "list", "tokens": ["type-label", "content-secondary", "space-inline-md"], "note": "ordered list; wraps rather than truncates when it cannot collapse" },
    { "part": "item", "tokens": ["space-inline-sm"] },
    { "part": "link", "tokens": ["content-secondary", "on-surface", "link-decoration", "link-decoration-offset", "focus", "radius-control", "duration-fast", "easing-standard"], "statesNote": "rest renders in content-secondary; hover/focus-visible resolve to on-surface (shadcn) or link (Salt) — a recipe difference on the same part" },
    { "part": "current", "contentSlot": true, "tokens": ["type-label", "on-surface"], "note": "the current page: aria-current=page, not a link, not focusable" },
    { "part": "separator", "iconRole": "forward", "tokens": ["icon-size-inline", "content-secondary"], "note": "decorative; aria-hidden. Chevron (shadcn / Salt LevelSeparatorIcon) or a caller-supplied glyph — recipe, same part" },
    { "part": "overflow", "optional": true, "iconRole": "overflow", "tokens": ["icon-size-control", "content-secondary", "interaction-hover", "radius-control", "focus"], "note": "collapse point when the trail exceeds maxItems" }
  ],
  "variantAxes": {},
  "states": ["rest", "hover", "focus-visible"],
  "anatomyNotes": "Parts are the intersection of shadcn Breadcrumb and Salt Breadcrumbs. Whether overflow is a static ellipsis (shadcn) or a menu disclosure listing the hidden items (Salt) is a BEHAVIOR option declared on the root, not a variant axis — the part is the same. Salt's separate BreadcrumbTrigger/BreadcrumbLabel split is composition over one link part.",
  "motion": { "state-transitions": { "duration": "duration-fast", "easing": "easing-standard" } }
}
