{
  "$schema": "../anatomy.schema.json",
  "name": "table",
  "behavior": "Native table semantics (table / rowgroup / row / columnheader / cell; caption names the table). APG grid pattern applies only when cell navigation or row selection makes it interactive.",
  "parts": [
    { "part": "root", "tokens": ["surface", "on-surface", "type-body", "border"], "note": "wrapped in an overflow container for horizontal scroll — wrapper is a recipe, not a part" },
    { "part": "caption", "optional": true, "tokens": ["type-caption", "content-secondary"] },
    { "part": "header-row", "tokens": ["border"], "note": "bottom rule separates header from body" },
    { "part": "header-cell", "tokens": ["type-label", "content-secondary", "inset-control-x", "control-height-md"] },
    { "part": "row", "tokens": ["border-subtle", "interaction-hover", "interaction-selected"], "statesNote": "hover only when rows are interactive; selected uses interaction-selected / on-interaction-selected" },
    { "part": "cell", "contentSlot": true, "tokens": ["type-body", "type-data", "inset-control-x"], "note": "numeric columns use type-data (tabular numerals) with end alignment; text columns use type-body" },
    { "part": "selection-column", "optional": true, "tokens": ["inset-control-x"], "note": "leading column hosting a checkbox per row plus a select-all header checkbox (indeterminate when partially selected)" }
  ],
  "variantAxes": { "size": ["sm", "md", "lg"] },
  "states": ["rest", "hover", "focus-visible", "selected"],
  "anatomyNotes": "size binds row height to control-height-*; themes with a density axis freeze it there. Zebra striping and sticky headers are recipe options on row/header-row, not anatomy."
}
