{
  "$schema": "../anatomy.schema.json",
  "name": "card",
  "behavior": "Static grouping container; no APG pattern (generic group semantics — interactive/selectable cards are a separate component, cf. Salt InteractableCard)",
  "parts": [
    { "part": "root", "tokens": ["surface-raised", "on-surface-raised", "radius-container", "inset-container", "elevation-raised", "border"] },
    { "part": "header", "optional": true, "tokens": ["space-stack-sm", "space-inline-md"], "note": "grid: title/description stack with trailing action-slot column" },
    { "part": "title", "optional": true, "contentSlot": true, "tokens": ["type-heading-3", "on-surface-raised"] },
    { "part": "description", "optional": true, "contentSlot": true, "tokens": ["type-body", "content-secondary"] },
    { "part": "action-slot", "optional": true, "tokens": ["space-inline-md"], "note": "trailing header slot for a button/menu; hosts other components, adds no recipe of its own" },
    { "part": "content", "contentSlot": true, "tokens": ["type-body", "space-stack-md"] },
    { "part": "footer", "optional": true, "tokens": ["space-inline-md", "border-subtle"], "note": "divider above footer is optional (border-subtle top rule)" }
  ],
  "variantAxes": {},
  "states": ["rest"],
  "anatomyNotes": "Padding lives on root as inset-container; shadcn applies it per-section and Salt via Card*Section subcomponents — a RECIPE difference, same anatomy. Elevation expression (shadow vs border) follows the theme's elevation-strategy."
}
