{
  "$schema": "../anatomy.schema.json",
  "name": "dropdown-menu",
  "behavior": "APG menu button pattern (trigger has aria-haspopup=menu + aria-expanded; Enter/Space/Down opens and focuses first item; arrow keys rove focus; typeahead; Esc closes and returns focus to trigger; role=menu / role=menuitem)",
  "parts": [
    { "part": "trigger", "tokens": ["type-action", "focus"], "note": "typically a button — anatomy delegated to anatomy/button.json; carries the expand icon role when rendered with an indicator" },
    { "part": "panel", "tokens": ["surface-overlay", "on-surface-overlay", "border", "radius-overlay", "elevation-overlay", "layer-dropdown"] },
    { "part": "item", "tokens": ["type-label", "interaction-hover", "interaction-active", "space-inline-md", "radius-control"] },
    { "part": "item-icon", "optional": true, "tokens": ["icon-size-inline", "space-inline-sm"] },
    { "part": "item-label", "contentSlot": true, "tokens": ["type-label"] },
    { "part": "item-shortcut", "optional": true, "tokens": ["type-data", "content-secondary"] },
    { "part": "separator", "tokens": ["border-subtle"] },
    { "part": "group-label", "optional": true, "tokens": ["type-caption", "content-secondary"] }
  ],
  "variantAxes": {},
  "states": ["rest", "hover", "active", "focus-visible", "disabled", "open"],
  "anatomyNotes": "A destructive item is emphasis:danger applied at item level: label and icon recolor with status-critical (hover recipe may use status-critical-surface) — same anatomy, no extra part. Checkbox/radio items are the item part plus the select option-indicator pattern.",
  "motion": { "panel-enter": { "duration": "duration-fast", "easing": "easing-enter" }, "panel-exit": { "duration": "duration-instant", "easing": "easing-exit" } }
}
